{"schema": "devorch.task_result.v1", "task_id": "DT-0001-r2", "contract_version": 1, "attempt": 1, "agent": "mdev-code-reviewer", "status": "completed", "summary": "did the work as asked", "head_commit": null, "modified_files": [], "commits": [], "tests": [{"id": "TC-UNIT-061", "command": "npm test -- test/unit/core/config", "exit_code": 0, "outcome": "passed"}, {"id": "TC-SEC-150", "command": "npm test -- test/unit/core/log/redactor", "exit_code": 0, "outcome": "passed"}, {"id": "typecheck", "command": "npm run typecheck", "exit_code": 0, "outcome": "passed"}], "defects": [], "findings": [], "outstanding_dependencies": [], "blocking_conditions": [], "recommended_next_action": "next", "evidence_refs": [], "reviewed_head_commit": "583b776a7dcc849d5b606620bddffdb4b29627a4", "recommendation": "accept"}