{"schema": "devorch.task_result.v1", "task_id": "DT-0001", "contract_version": 1, "attempt": 2, "agent": "mdev-backend-engineer", "status": "completed", "summary": "Clamping and negative test added (CR-DT0001-01).", "head_commit": "f9e9ecfe918cb6fdf3ba6686256ad461d2ae4eb3", "modified_files": ["src/core/config/load.ts", "src/core/log/redact.ts", "test/unit/core/config/clamp.test.ts"], "commits": ["f9e9ecfe918cb6fdf3ba6686256ad461d2ae4eb3", "481c79b87e142d174541cfd5871e4ef5d7e06bfc", "4514df475f6d7012e4f23666d0afe383fb972b06"], "tests": [{"id": "TC-UNIT-061", "command": "npm test -- test/unit/core/config", "exit_code": 0, "outcome": "passed", "runs": 1}, {"id": "TC-SEC-150", "command": "npm test -- test/unit/core/log/redactor", "exit_code": 0, "outcome": "passed", "runs": 1}, {"id": "typecheck", "command": "npm run typecheck", "exit_code": 0, "outcome": "passed", "runs": 1}], "defects": [], "findings": [], "outstanding_dependencies": [], "blocking_conditions": [], "recommended_next_action": "next", "evidence_refs": []}