{
  "schema": "devorch.task_result.v1",
  "task_id": "DT-0001-r1",
  "contract_version": 1,
  "attempt": 1,
  "agent": "mdev-code-reviewer",
  "status": "completed",
  "summary": "Reviewed main..2a4b6c8 (8 files). Tests re-run: all pass. One blocking finding: config clamps silently accept out-of-range values instead of clamping+warning as macos-service \u00a72 requires.",
  "head_commit": null,
  "modified_files": [],
  "commits": [],
  "tests": [
    {
      "id": "TC-UNIT-061",
      "command": "npm test -- test/unit/core/config",
      "exit_code": 0,
      "outcome": "passed"
    }
  ],
  "defects": [],
  "findings": [
    {
      "id": "CR-DT0001-01",
      "severity": "medium",
      "blocking": true,
      "location": "src/core/config/load.ts:88",
      "design_ref": "docs/mercury/operations/macos-service.md\u00a72",
      "description": "Values above the hard cap are accepted unchanged.",
      "required_correction": "Clamp to the cap, log config.clamped with the key name (no value), add a negative test."
    },
    {
      "id": "CR-DT0001-02",
      "severity": "low",
      "blocking": false,
      "location": "src/core/paths.ts:12",
      "description": "Constant name differs from ADR-016 table.",
      "required_correction": "Optional rename."
    }
  ],
  "recommendation": "changes_required",
  "gate_result": {
    "gate": "G3",
    "result": "fail"
  },
  "outstanding_dependencies": [],
  "blocking_conditions": [
    "CR-DT0001-01"
  ],
  "recommended_next_action": "Correction contract to mdev-backend-engineer (attempt 2).",
  "evidence_refs": [
    "evidence/DT-0001-r1/attempt-1/review.md"
  ]
}